{
  "schemaVersion": 1,
  "university": {
    "id": "alberta",
    "name": "University of Alberta",
    "province": "Alberta"
  },
  "coverage": "Partial pilot: selected research faculty from the Department of Computing Science and Department of Mathematical and Statistical Sciences. Identity and affiliation are sourced from institutional rosters; graduate recruitment and funding remain unknown unless separately supported. Individual supervision eligibility and departmental completeness have not been established.",
  "professors": [
    {
      "id": "alberta-j-nelson-amaral",
      "name": "J Nelson Amaral",
      "sortName": "Amaral, J Nelson",
      "universityId": "alberta",
      "department": "Department of Computing Science",
      "disciplines": [
        "cs"
      ],
      "interests": [],
      "links": [
        {
          "kind": "university",
          "url": "https://apps.ualberta.ca/directory/search/department/360300",
          "label": "Institutional faculty roster"
        },
        {
          "kind": "university",
          "url": "https://apps.ualberta.ca/directory/person/jamaral",
          "label": "Original profile"
        }
      ],
      "identityEvidence": {
        "url": "https://apps.ualberta.ca/directory/search/department/360300",
        "quote": "Amaral, J Nelson",
        "checkedAt": "2026-10-29T22:47:36.269Z",
        "sourceDate": null
      },
      "recruitment": [],
      "funding": [],
      "applicationInstructions": null,
      "conflicts": [],
      "portrait": null
    },
    {
      "id": "alberta-omid-ardakanian",
      "name": "Omid Ardakanian",
      "sortName": "Ardakanian, Omid",
      "universityId": "alberta",
      "department": "Department of Computing Science",
      "disciplines": [
        "cs"
      ],
      "interests": [],
      "links": [
        {
          "kind": "university",
          "url": "https://apps.ualberta.ca/directory/search/department/360300",
          "label": "Institutional faculty roster"
        },
        {
          "kind": "university",
          "url": "https://apps.ualberta.ca/directory/person/oardakan",
          "label": "Original profile"
        }
      ],
      "identityEvidence": {
        "url": "https://apps.ualberta.ca/directory/search/department/360300",
        "quote": "Ardakanian, Omid",
        "checkedAt": "2026-10-29T22:47:36.269Z",
        "sourceDate": null
      },
      "recruitment": [],
      "funding": [],
      "applicationInstructions": null,
      "conflicts": [],
      "portrait": null
    },
    {
      "id": "alberta-denilson-barbosa",
      "name": "Denilson Barbosa",
      "sortName": "Barbosa, Denilson",
      "universityId": "alberta",
      "department": "Department of Computing Science",
      "disciplines": [
        "cs"
      ],
      "interests": [],
      "links": [
        {
          "kind": "university",
          "url": "https://apps.ualberta.ca/directory/search/department/360300",
          "label": "Institutional faculty roster"
        },
        {
          "kind": "university",
          "url": "https://apps.ualberta.ca/directory/person/denilson",
          "label": "Original profile"
        }
      ],
      "identityEvidence": {
        "url": "https://apps.ualberta.ca/directory/search/department/360300",
        "quote": "Barbosa, Denilson",
        "checkedAt": "2026-10-29T22:47:36.269Z",
        "sourceDate": null
      },
      "recruitment": [],
      "funding": [],
      "applicationInstructions": null,
      "conflicts": [],
      "portrait": null
    },
    {
      "id": "alberta-anup-basu",
      "name": "Anup Basu",
      "sortName": "Basu, Anup",
      "universityId": "alberta",
      "department": "Department of Computing Science",
      "disciplines": [
        "cs"
      ],
      "interests": [],
      "links": [
        {
          "kind": "university",
          "url": "https://apps.ualberta.ca/directory/search/department/360300",
          "label": "Institutional faculty roster"
        },
        {
          "kind": "university",
          "url": "https://apps.ualberta.ca/directory/person/basu",
          "label": "Original profile"
        }
      ],
      "identityEvidence": {
        "url": "https://apps.ualberta.ca/directory/search/department/360300",
        "quote": "Basu, Anup",
        "checkedAt": "2026-10-29T22:47:36.269Z",
        "sourceDate": null
      },
      "recruitment": [],
      "funding": [],
      "applicationInstructions": null,
      "conflicts": [],
      "portrait": null
    },
    {
      "id": "alberta-michael-bowling",
      "name": "Michael Bowling",
      "sortName": "Bowling, Michael",
      "universityId": "alberta",
      "department": "Department of Computing Science",
      "disciplines": [
        "cs"
      ],
      "interests": [],
      "links": [
        {
          "kind": "university",
          "url": "https://apps.ualberta.ca/directory/search/department/360300",
          "label": "Institutional faculty roster"
        },
        {
          "kind": "university",
          "url": "https://apps.ualberta.ca/directory/person/mbowling",
          "label": "Original profile"
        }
      ],
      "identityEvidence": {
        "url": "https://apps.ualberta.ca/directory/search/department/360300",
        "quote": "Bowling, Michael",
        "checkedAt": "2026-10-29T22:47:36.269Z",
        "sourceDate": null
      },
      "recruitment": [],
      "funding": [],
      "applicationInstructions": null,
      "conflicts": [],
      "portrait": null
    },
    {
      "id": "alberta-vadim-bulitko",
      "name": "Vadim Bulitko",
      "sortName": "Bulitko, Vadim",
      "universityId": "alberta",
      "department": "Department of Computing Science",
      "disciplines": [
        "cs"
      ],
      "interests": [],
      "links": [
        {
          "kind": "university",
          "url": "https://apps.ualberta.ca/directory/search/department/360300",
          "label": "Institutional faculty roster"
        },
        {
          "kind": "university",
          "url": "https://apps.ualberta.ca/directory/person/bulitko",
          "label": "Original profile"
        }
      ],
      "identityEvidence": {
        "url": "https://apps.ualberta.ca/directory/search/department/360300",
        "quote": "Bulitko, Vadim",
        "checkedAt": "2026-10-29T22:47:36.269Z",
        "sourceDate": null
      },
      "recruitment": [],
      "funding": [],
      "applicationInstructions": null,
      "conflicts": [],
      "portrait": null
    },
    {
      "id": "alberta-marlos-c-machado",
      "name": "Marlos C. Machado",
      "sortName": "C. Machado, Marlos",
      "universityId": "alberta",
      "department": "Department of Computing Science",
      "disciplines": [
        "cs"
      ],
      "interests": [],
      "links": [
        {
          "kind": "university",
          "url": "https://apps.ualberta.ca/directory/search/department/360300",
          "label": "Institutional faculty roster"
        },
        {
          "kind": "university",
          "url": "https://apps.ualberta.ca/directory/person/machado",
          "label": "Original profile"
        }
      ],
      "identityEvidence": {
        "url": "https://apps.ualberta.ca/directory/search/department/360300",
        "quote": "C. Machado, Marlos",
        "checkedAt": "2026-10-29T22:47:36.269Z",
        "sourceDate": null
      },
      "recruitment": [],
      "funding": [],
      "applicationInstructions": null,
      "conflicts": [],
      "portrait": null
    },
    {
      "id": "alberta-jocelyn-qiaochu-chen",
      "name": "Jocelyn Qiaochu Chen",
      "sortName": "Chen, Jocelyn Qiaochu",
      "universityId": "alberta",
      "department": "Department of Computing Science",
      "disciplines": [
        "cs"
      ],
      "interests": [],
      "links": [
        {
          "kind": "university",
          "url": "https://apps.ualberta.ca/directory/search/department/360300",
          "label": "Institutional faculty roster"
        },
        {
          "kind": "university",
          "url": "https://apps.ualberta.ca/directory/person/qiaochu8",
          "label": "Original profile"
        }
      ],
      "identityEvidence": {
        "url": "https://apps.ualberta.ca/directory/search/department/360300",
        "quote": "Chen, Jocelyn Qiaochu",
        "checkedAt": "2026-10-29T22:47:36.269Z",
        "sourceDate": null
      },
      "recruitment": [],
      "funding": [],
      "applicationInstructions": null,
      "conflicts": [],
      "portrait": null
    },
    {
      "id": "alberta-euijin-choo",
      "name": "Euijin Choo",
      "sortName": "Choo, Euijin",
      "universityId": "alberta",
      "department": "Department of Computing Science",
      "disciplines": [
        "cs"
      ],
      "interests": [],
      "links": [
        {
          "kind": "university",
          "url": "https://apps.ualberta.ca/directory/search/department/360300",
          "label": "Institutional faculty roster"
        },
        {
          "kind": "university",
          "url": "https://apps.ualberta.ca/directory/person/euijin",
          "label": "Original profile"
        }
      ],
      "identityEvidence": {
        "url": "https://apps.ualberta.ca/directory/search/department/360300",
        "quote": "Choo, Euijin",
        "checkedAt": "2026-10-29T22:47:36.269Z",
        "sourceDate": null
      },
      "recruitment": [],
      "funding": [],
      "applicationInstructions": null,
      "conflicts": [],
      "portrait": null
    },
    {
      "id": "alberta-carrie-demmans-epp",
      "name": "Carrie Demmans Epp",
      "sortName": "Demmans Epp, Carrie",
      "universityId": "alberta",
      "department": "Department of Computing Science",
      "disciplines": [
        "cs"
      ],
      "interests": [],
      "links": [
        {
          "kind": "university",